topic_index,topic_id,topic_title,tag_id,tag_name,level,is_new,topic_is_show,question_index,question_id,part,question_is_show,content
142,1352,历史时期/不喜欢的广告/投诉,20,事件,0,0,0,1,3868,4,0,历史时期 Describe a historical period you would like to know more You should say: When it happened What you are interested in What you have known And why you would like to know more .不喜欢的广告 Describe an advertisement you don't like You should say: Where and when you first saw it What type of advertisement it is What product or service it advertises And explain why you don't like it 投诉 Describe a time when you made a complaint and were satisfied with the result You should say: When it happened Who you complained to What you complained about And explain why you were satisfied with the result
143,1351,想学的技能/想要一起学习工作的人/喜欢的日常事务,20,事件,0,0,0,1,3867,4,0,想学的技能 Describe something you would like to learn in the future You should say: What it is How you would like to learn it Where you would like to learn it Why you would like to learn it And explain whether it's difficult to learn it 17.想要一起学习/工作的人 Describe a person you have met who you want to work/study with You should say: Who this person is How you met this person How long you have known him/her And explain why you want to work/study with him/her 18.喜欢的日常事务 Describe a daily routine that you enjoy You should say: What it is Where and when you do it Who you do it with And explain why you enjoy it
144,1350,收到想要的礼物/童年喜欢的活动/让你骄傲的事,20,事件,0,0,0,1,3866,4,0,收到想要物品 Describe a gift you got You should say: What it was When you received it Who gave it to you And explain why you wanted it so much 童年喜欢的活动 Describe a activity you enjoyed in your free time when you were young You should say: What it was Where you did it Who you did it with And explain why you enjoyed it 让你骄傲的事 Describe something you did that made you feel proud You should say: What it was How you did it What difficult you had How you dealt with the difficulty And explain why you felt proud of it
145,1349,聚会上遇到的人/不寻常的一餐/爱豆的电影角色,20,事件,0,0,0,1,3865,4,0,聚会上遇到的人 Describe a person you met at a party who you enjoyed talking with You should say: What party it was Who the person is What you talked about And explain why you enjoy it 不寻常的一餐 Describe an unusual meal you had You should say: When you had it Where you had it Whom you had it with And explain why it was unusual 爱豆的电影角色 Describe a film character played by an actor or actress whom you admire You should say: Who this actor/actress is When you saw the film What the character was like in this film And explain why you admire this actor/actress
146,1348,常用网站/科技产品/教他人做事,20,事件,0,0,0,1,3864,4,0,常用网站 Describe a website you often visit You should say: How you found it What it is about How often you visit it And explain why you often visit it 科技产品 Describe a piece of technology that you feel difficult to use You should say: When you got it What you got it for How often you use it And explain how you feel about it 教他人做事 Describe a time when you taught a friend/relative something You should say: Who you taught What/how you taught What the result was And explain how you felt about the experience
147,1347,居住地发展/空气糟糕之地/放松的地方,20,事件,0,0,0,1,3863,4,0,"居住地发展 Describe a new development in the area where you live (e.g.shopping mall, park...) You should say: What the development is When/where you noticed it How long it took to complete it And explain how you feel about it 空气糟糕之地 Describe a place you visited where the air was polluted You should say: Where the place is When you visited there Why the air was not good And explain how you felt about the place 放松的地方 Describe your favorite place in your house where you can relax You should say: Where it is What it is like What you enjoy doing there And explain why you feel relaxed at this place"
148,1346,他城的短暂停留/嘈杂地/和别人一起做的事,20,事件,0,0,0,1,3862,4,0,他城的短暂停留 Describe another city you would like to stay for a short time You should say: Where the city is Why you want to go there Whom you will go there with What you will do there And explain why you will stay there just for a short time 嘈杂地 Describe a noisy place you have been to You should say: What it is When you went there What you did there And explain why you feel it's a noisy place 和别人一起做的事 Describe something that you did with someone/a group of people You should say: What it was Who you did it with How long it took you to do this And explain why you did it together
149,1292,激励你做有趣事情的人/受到表扬,20,事件,0,0,0,1,3718,4,0,Describe a person who inspired you to do something interesting You should say: Who he/she is How you know him/her What interesting thing you did And explain how he/she inspired you Describe a time you received positive feedback You should say: What you did Who gave you the feedback Why he/she gave you the positive feedback And explain how you felt about it
150,1290,让你自豪的照片/侍花弄果之人,20,事件,0,0,0,1,3711,4,1,让你自豪的照片/侍花弄果之人
151,1289,失约/争论/和朋友的争执/不喜欢到喜欢的朋友,20,事件,1,0,0,1,3710,4,1,同学可以结合题库的具体问题，练习素材。 1. 为了更好的匹配每一道题，素材本身的字数会超过真实的考试同学们能表达字数。 2. 针对不同的问法，同学的开头和结尾需要进行调整。 3. 一定要注意表达的自然程度～必要时增加重音，表情和手势
152,1288,印象深刻的英语课/信息搜索,20,事件,0,0,0,1,3709,4,1,同学可以结合题库的具体问题，练习素材。 1. 为了更好的匹配每一道题，素材本身的字数会超过真实的考试同学们能表达字数。 2. 针对不同的问法，同学的开头和结尾需要进行调整。 3. 一定要注意表达的自然程度～必要时增加重音，表情和手势
153,1287,糟糕购物/决意等待,20,事件,1,0,0,1,3708,4,1,同学可以结合题库的具体问题，练习素材。 1. 为了更好的匹配每一道题，素材本身的字数会超过真实的考试同学们能表达字数。 2. 针对不同的问法，同学的开头和结尾需要进行调整。 3. 一定要注意表达的自然程度～必要时增加重音，表情和手势
154,1286,喜欢看的电影/有趣小说或故事/搞笑电影,19,事物,1,0,0,1,3707,4,1,喜欢看的电影/有趣小说或故事/搞笑电影 Describe a story or novel you have read that you found interesting Describe a movie you watched recently and would like to watch again Describe a film that made you laugh
155,1285,分享/喜欢的节目,19,事物,0,0,0,1,3706,4,0,Describe something you had to share with others You should say: What it was Who you shared it with Why you had to share it with others And explain how you felt about it Describe a program you like to watch You should say: What it is What it is about Who you watch it with And explain why you like to watch it
156,1284,侍花弄果之人/让你自豪的照片/激励你做有趣事情的人/聪明的人/劝你的人/被夸赞的经历,18,人物,0,0,0,1,3705,4,1,同学可以结合题库的具体问题，练习素材。 1. 为了更好的匹配每一道题，素材本身的字数会超过真实的考试同学们能表达字数。 2. 针对不同的问法，同学的开头和结尾需要进行调整。 3. 一定要注意表达的自然程度～必要时增加重音，表情和手势
157,1283,塑料废品/漂亮物品/常去的熟人之家/别人家的房间,19,事物,1,0,0,1,3704,4,1,同学可以结合题库的具体问题，练习素材。 1. 为了更好的匹配每一道题，素材本身的字数会超过真实的考试同学们能表达字数。 2. 针对不同的问法，同学的开头和结尾需要进行调整。 3. 一定要注意表达的自然程度～必要时增加重音，表情和手势
158,1282,学到的重要事情/克服困难终成功/户外活动,20,事件,0,0,0,1,3703,4,0,同学可以结合题库的具体问题，练习素材。 1. 为了更好的匹配每一道题，素材本身的字数会超过真实的考试同学们能表达字数。 2. 针对不同的问法，同学的开头和结尾需要进行调整。 3. 一定要注意表达的自然程度～必要时增加重音，表情和手势
159,1281,运动场所/向旅游者推荐你国家的一个地方/想再去一次的城市,21,地点,1,0,0,1,3702,4,1,同学可以结合题库的具体问题，练习素材。 1. 为了更好的匹配每一道题，素材本身的字数会超过真实的考试同学们能表达字数。 2. 针对不同的问法，同学的开头和结尾需要进行调整。 3. 一定要注意表达的自然程度～必要时增加重音，表情和手势
160,1280,认识的不同文化的人/发小/表达情绪的人/时尚人士/想要一起学习or工作的人,18,人物,1,0,0,1,3701,4,1,同学可以结合题库的具体问题，练习素材。 1. 为了更好的匹配每一道题，素材本身的字数会超过真实的考试同学们能表达字数。 2. 针对不同的问法，同学的开头和结尾需要进行调整。 3. 一定要注意表达的自然程度～必要时增加重音，表情和手势
161,1209,有趣的讨论/送给朋友的礼物,20,事件,3,0,0,1,3502,4,0,Describe an interesting discussion you had with your friend You should say: What the discussion was about What opinions you and your friend had Why you think the discussion was interesting And how you felt about it Describe a gift you would like to buy for your friend You should say: How you knew your friend How long you have known him/her How you would choose a gift for him/her And explain why you would choose that gift for him/her
162,1206,积极的改变/节约时间的方法、改变,20,事件,3,0,0,1,3499,4,0,Describe a positive change that you made in your life You should say: What the change was Why you did it Who you did it with And explain how you feel about the change Describe a way/change that helps you save a lot of time You should say What it is How you implement it How difficult it is And explain how you feel about the way/change
163,1204,帮助集中注意力的方法/改变世界的发明,19,事物,1,0,0,1,3497,4,0,Describe something you do that can help you concentrate on work/study You should say: What it is How it helps you concentrate When you do it And explain how you feel about it Describe an invention that has changed the world in a positive way You should say: What it is What benefits it has brought How it influences people of different ages And explain how it changed people's lives
164,1202,帮助小孩/一次非常忙碌的经历,20,事件,2,0,0,1,3495,4,0,Describe a time when you helped a child You should say: When it was How you helped him/her Why you helped him/her And how you felt about it Describe a time you were very busy You should say: When it happened Where you were What you did And explain why you were busy
165,1197,保健方式/想参加的比赛,20,事件,3,0,0,1,3490,4,0,Describe something you do to keep fit and healthy You should say: What it is When you do it Who you do it with And explain why you think this method is important Describe a contest/competition you would like to participate in You should say: What the contest/competition is about Where the contest/competition will take place When it will be held And explain why you would like to participate in it
166,1159,不喜欢的规则/对社会有贡献的人,18,人物,2,0,0,1,3365,4,0,不喜欢的规则 Describe a rule that you don't like You should say: What it is Why you don't like it How others feel about the rule And explain whether you've followed the rule 对社会有贡献的人 Describe a person who contributes to the society You should say: Who the person is How you knew him/her What type of work he/she does And explain why you think he/she contributes to the society
167,1155,快乐活动/有趣的谈话,20,事件,2,0,0,1,3358,4,0,快乐活动 Describe a happy event you organized You should say: What the event was Where you had it Who helped you to organized And how you feel about it 有趣的谈话 Describe an interesting discussion you had with your friend You should say: What the discussion was about What opinions you and your friend had Why you think the discussion was interesting And how you felt about it
168,1154,社交媒体上常刷的人/感兴趣的名人,0,,0,0,0,1,3357,4,1,社交媒体上常刷的人（确认新题） Describe a person who you follow on social media You should say: Who he/she is How you knew him/her What he/she posts on social media And explain why you follow him/her on social media 感兴趣的名人（确认保留） Describe a famous person you are interested in You should say: Who he/she is How you knew about him/her What he/she was like before he/she became famous And explain why you are interested in him/her
169,1151,有趣的歌曲/印象深刻的课程,19,事物,2,0,0,1,3354,4,0,有趣的歌曲 Describe an interesting song You should say: What the song is What story the song tells Whether the song is popular 印象深刻的课程 Describe a course that impressed you a lot You should say: What the course was about Where you took the course What you did during the course And explain why it impressed you a lot
170,1149,坏掉又修好的东西/免费物品,19,事物,3,0,0,1,3352,4,0,免费物品 Describe something you received for free You should say: What it was Who you received it from Where you received it And how you felt about it 掉又修好的东西 Describe something in your home you broke and then repaired You should say: What it is How you broke it How you repaired it And how you felt about it
171,1148,壮志未酬/想要的公寓和房子,19,事物,2,0,0,1,3351,4,0,壮志未酬 Describe an ambition that you haven't achieved You should say: What it is Why you haven't achieved it What you did And how you felt about it 想要的公寓或房子 Describe a house or an apartment you would like to live in You should say: What it is like Where it would be Why you would like to live in this house/apartment And how you feel about this house/apartment
172,1147,一个去过的新地方/乡村一隅,21,地点,1,0,0,1,3350,4,0,Describe a new place you visited You should say: Where it is When you went there Why you went there And explain how you feel about the place Describe a place in a village that you visited You should say: Where it is When you visited this place What you did there And how you feel about this place
173,1063,有趣的外国人/有名的运动员,0,,0,0,0,1,3140,4,0,Describe a foreign person who you have heard or known that you think is interesting Describe a famous athlete you know
174,1062,难学的技能/一件困难的事情,0,,0,0,0,1,3139,4,0,Describe a skill that was difficult for you to learn Describe a difficult thing you did
175,1061,希望养成的习惯/搬到(新家/)新学校,0,,0,0,0,1,3138,4,0,Describe a habit your friend has and you want to develop Describe a time when you moved to a new home or school
176,1060,花费超过预期的物品/困难的决定,0,,0,0,1,1,3137,4,0,Describe an item on which you spent more than expected Describe a difficult decision that you once made
177,1059,善待不喜欢的人/浪费时间的活动,0,,0,0,0,1,3136,4,0,Describe a time you were friendly to someone you didn't like Describe an activity you usually do that wastes your time
178,1058,等待特殊事情/早起/敬佩的商人,20,事件,3,0,0,1,3135,4,0,Describe a time when you waited for something special that would happen Describe a time when you got up early Describe a businessman that you admire
179,1057,度假之地/成功完成的事,0,,0,0,0,1,3134,4,0,Describe a place you visited on vacation and would like to recommend to others Describe a time you had to do something and had a positive result
180,1056,为家人骄傲/（自行车/摩托车/）汽车旅行/想学的感兴趣的技能,0,,0,0,1,1,3133,4,0,Describe a time when you felt proud of a family member Describe a bicycle/motorcycle/car trip you would like to go Describe something that you are interested to learn or improve
181,1055,小学印象最深的人/机智解决问题的人,0,,0,0,1,1,3132,4,0,Describe a person who impressed you most when you were in primary school Describe a person who solved a problem in a smart way
182,1054,激动人心的书/有创造力的人,0,,0,0,0,1,3131,4,0,Describe an exciting book that you enjoy reading Describe a creative person whose work you admire
183,1053,优质服务/咖啡馆,0,,0,0,0,1,3130,4,0,Describe a good service you received Describe a café you like to visit
184,1006,分享/健康文章/校外学习的重要事情,20,事件,1,0,0,1,2975,4,1,同学可以结合题库的具体问题，练习素材。 1. 为了更好的匹配每一道题，素材本身的字数会超过真实的考试同学们能表达字数。 2. 针对不同的问法，同学的开头和结尾需要进行调整。 3. 一定要注意表达的自然程度～必要时增加重音，表情和手势
185,1005,（保留）微笑的场合/海边活动/学习工作之余的活动,0,,0,0,1,1,2974,4,0,Describe an occasion when many people were smiling Describe a leisure activity on/near the sea that you want to try Describe an activity that you do after school/ work
186,1004,（保留）喜欢的歌手或演员/尊敬的老人,0,,0,0,0,1,2973,4,0,Describe your favorite singer or actor Describe someone who is older than you that you admire Describe a plan in your life (that is not related to work or study)
187,1003,（保留）做手工/社交媒体趣事/不太成功的经历,0,,0,0,0,1,2972,4,0,"Describe an art or craft activity (e.g. painting, woodwork, etc.) that you had (at school) Describe a time you saw something interesting on social media Describe a time when you tried to do something but was not very successful"
188,1002,（保留）禁用手机的场合/安静的地方,0,,0,0,0,1,2971,4,0,Describe an occasion when you were not allowed to use your mobile phone Describe a quiet place you like to spend your time in
189,1001,（保留）环保法律/当地新闻,0,,0,0,0,1,2970,4,0,Describe a law on environmental protection Describe a piece of local news that people are interested in
190,1000,（保留）想生活的城市/雇佣很多员工的公司/高楼,0,,0,0,0,1,2969,4,0,Describe a town or city where you would like to live in the future Describe a company where you live that employs a lot people Describe a tall building in your city you like or dislike
191,999,（保留）朋友争执/喜欢的电影/帮助朋友,0,,0,0,0,1,2968,4,0,Describe an argument two of your friends had Describe a movie that you like Describe a time when you helped a friend
192,998,（保留）智力游戏/想提升的天赋/生活计划,0,,0,0,0,1,2967,4,0,"Describe a puzzle you have played(Jigsaw, Crossword, etc.) Describe a natural talent (sports, music, etc) you want to improve"
193,950,拜访过但不想住的家/不喜欢的短途旅行,0,,0,0,0,1,2831,4,0,Describe a home that you visited but did not want to live in Describe a short trip you often take but do not like
194,949,喜欢的天气/喜欢的城镇区域,0,,0,0,0,1,2830,4,0,Describe a kind of weather you like Describe a part of a city or town you enjoy spending time in
195,948,电脑罢工/告诉朋友实情（低频）,0,,0,0,0,1,2829,4,0,Describe a time when your computer broke down Describe a time when you told your friend an important truth
196,947,许下的承诺/对家庭重要的东西（保留）,0,,0,0,1,1,2828,4,0,Describe a time you made a promise to someone Describe something important that has been kept in your family for a long time
197,946,现场体育比赛/教别人的技能/看过的体育比赛/喜欢的节目/想看的体育赛事/经常登录的网站,20,事件,1,0,0,1,2827,4,1,现场体育比赛/教别人的技能/看过的体育比赛/喜欢的节目/想看的体育赛事/经常登录的网站Describe a sports event you would like to watch Describe a sports competition you watched. Describe a website you often visit
198,945,童年喜欢的玩具/买到开心的东西/礼貌的人,0,,0,0,0,1,2826,4,0,Describe a toy you liked in your childhood Describe a thing that you bought and felt pleased about Describe a polite person you know
199,944,有趣的家乡传统/第一次吃的食物,0,,0,0,0,1,2825,4,0,Describe an interesting tradition in your country Describe a time when you ate something for the first time
200,943,发挥想象力/有趣的谈话/给别人建议（保留）,0,,0,0,1,1,2824,4,0,Describe a time you needed to use your imagination Describe an interesting conversation Describe a time when you gave advice to others
201,942,排久久的队/无聊的经历,0,,0,0,0,1,2823,4,0,Describe a time you had to wait in line (queue up) for a long time Describe a time when you felt bored
202,941,相见的名人/奇装异服的人（保留）,0,,0,0,0,1,2822,4,0,Describe a famous person you are interested in Describe a person who you think wears unusual clothes
203,940,完美的工作/在国外的短期工作,0,,0,0,0,1,2821,4,0,Describe a perfect job you would like to have in the future Describe a short term job you want to have in a foreign country
204,939,鼓励别人做不愿做的事/好消息（好消息非本季度考题),0,,0,0,1,1,2820,4,0,Describe a time when you encouraged someone to do something that he/she didn't want to do Describe a time when you received good news
205,938,迷路/野生动物,0,,0,0,0,1,2819,4,0,Describe a time when you were lost Describe a time when you got close to wild animals
206,860,聪明的人/有用的书,0,,0,0,0,1,2599,4,0,Describe a person who is intelligent Describe a book you read that you find useful
207,859,长久的追求 /不喜欢的对话,0,,0,0,0,1,2598,4,0,Describe an ambition that you have had for a long time Describe a conversation you were not interested in
208,858,改变想法/坦率的人,0,,0,0,0,1,2597,4,0,Describe a time when you changed your opinion Describe a person who you think is very open
209,857,喜欢的公共建筑/放松的地方/好消息,0,,0,0,0,1,2596,4,0,Describe an impressive public building that you enjoyed visiting Describe a place that can be good to relax Describe a time when you received good news
210,856,室内游戏/短期外国工作/遇到朋友时惊讶的情形,0,,0,0,0,1,2595,4,0,Describe an experience that you enjoyed an indoor game Describe a job you would like to do in a foreign country for a short term Describe a time when you were surprised to meet a friend
211,855,忘记的重要的事情/好决定,0,,0,0,0,1,2594,4,0,Describe an occasion when you forgot something important Describe a good decision you made recently
212,854,团队一员（团队合作）/第一次用外语交流,0,,0,0,0,1,2593,4,0,Describe something you enjoyed doing with a group of people Describe a friend who is a good leader Describe the time when you first talked in a foreign language
213,853,感兴趣的科学领域/偶尔参加的有些昂贵的活动,0,,0,0,0,1,2592,4,0,"Describe an area of science(physics,biology,psychology,etc) that interests you Describe an activity that you attend occasionally but a little expensive"
214,852,让你笑的电影/有活力的人,0,,0,0,0,1,2591,4,0,Describe a movie that made you laugh Describe a person who is full of energy
215,851,有趣的家乡传统/小时候教我技能的人,0,,0,0,0,1,2590,4,0,Describe an interesting tradition in your country Describe a person who taught you who taught you a skill when you were a child
216,850,歌词诗句/获奖经历/喜欢的照片,0,,0,0,0,1,2589,4,0,Describe a prize you have ever won Describe a line(or a few words) that you remember from a poem or song Describe a photo of you that you like
217,849,小孩子在公共场合不好的行为/有不喜欢的音乐的经历,0,,0,0,0,1,2588,4,0,Describe a misbehavior of children in the public Describe an event you experienced in which you didn’t like the music played
218,848,最近联系的老朋友/乐于助人的人/喜欢的一家人,0,,0,0,0,1,2587,4,0,Describe an old friend you got in contact again Describe a person who like to help others Describe a family that you like
220,479,参加的聚会/手工礼物,0,,0,0,0,1,1603,4,0,Describe a party that you joined Describe a present you received which was made by hand
221,477,想去的远行/买来不常用的东西/童年游戏,0,,0,0,0,1,1602,4,0,Describe a place you plan to travel to that is far away from your home Describe an item you bought but do not often use Describe a game that you played in your childhood
222,476,没见过但想了解的人/有趣的老人,0,,0,0,0,1,1601,4,0,Describe someone you have never seen but would like to know more about Describe an interesting old person
223,474,想写的书/祖父母工作,0,,0,0,0,1,1599,4,0,Describe a book you want to write Describe one of your grandparent’s jobs
224,468,没有空的时候/改变计划,0,,0,0,0,1,1593,4,0,Describe an occasion when you didn’t have enough time for something Describe a time that you had to change your mind or plan
225,466,第一次户外运动/空闲时光,0,,0,0,0,1,1591,4,0,Describe an outdoor sport you played for the first time Describe a time you enjoyed your free time
226,404,有趣的动物/改变计划/喜欢的杂志2,0,,0,0,0,1,1404,4,0,Describe an interesting animal Describe a time that you had to change your mind/plan Describe a magazine you enjoy reading
