topic_index,topic_id,topic_title,tag_id,tag_name,level,is_new,topic_is_show,question_index,question_id,part,question_is_show,content
56,1748,精力充沛的人\祖辈工作,19,事物,2,0,0,1,5540,4,1,Describe an energetic person that you know You should say: Who this person is How you knew this person Why you think this person is energetic And explain how you feel about this person； Describe one of your grandparents’ job You should say: what it was how long he or she had this job how he or she got the job what skills this job needs and whether you would like to have this job in thefuture
57,1747,感兴趣的科学学科\诗句或歌词\近期计划的改变,19,事物,0,0,0,1,5539,4,1,Describe a science subject that you are interested in You should say: What it is Where you got to know it How you have learned it And explain why you are interested in it； Describe a line(or a few words) that you remember from a poem or song You should say: What it is Which song or poem it is from How you knew it And explain how you feel about it； Describe a positive change that you have made recently in your daily routine You should say: What the change is How you have changed the routine Why you think it is a positive change And explain how you feel about the change
58,1746,许下的承诺\学校/工作中的重要规则,20,事件,0,0,0,1,5538,4,1,Describe a time you made a promise to someone You should say: What the promise was To whom you made it Whether it was easy or difficult to keep And explain why you made it； Describe a rule that is important in your school or at work You should say: What the rule is about What happens when people break the rule Why you think it is an important rule And explain how you feel about the rule
59,1743,弄丢贵重物品\少年的榜样,20,事件,0,0,0,1,5532,4,1,Describe a time when you lost a valuable item You should say: When and where it happened What it was How valuable it was How you lost it And explain how you felt about the experience； Describe someone (a famous person) that is a role model for young people You should say: Who he/she is How you knew him/her What he/she has done And explain why he/she can be a role model for young people
60,1742,想去的外国/重要决定/近期日常改变,21,地点,0,0,0,1,5531,4,1,Describe an important decision that you made You should say: What the decision was How you made your decision What the results of the decision were And explain why it was important; Describe a foreign country you would like to visit in the future You should say: What it is What you have known about it Who you would like to go there with And explain why you would like to visit it； Describe a positive change that you have made recently in your daily routine You should say: What the change is How you have changed the routine Why you think it is a positive change And explain how you feel about the change
61,1741,学校、工作中的重要规则/忘记重要事情,20,事件,0,0,0,1,5530,4,1,Describe an occasion when you forgot something important You should say: When it was What you forgot Why you forgot it And how you felt about it； Describe a rule that is important in your school or at work You should say: What the rule is about What happens when people break the rule Why you think it is an important rule And explain how you feel about the rule
62,1740,交通工具抛锚/感兴趣的科学学科,19,事物,0,0,0,1,5529,4,1,Describe a time when the vehicle you took broke down on your trip You should say: Where it happened When it happened Who you were with at that time And what impacts this breakdown had； Describe a science subject that you are interested in You should say: What it is Where you got to know it How you have learned it And explain why you are interested in it
63,1739,精力充沛的人/乡村一隅/别人家的好房子/安静的地方/想共度时光的人/理想房屋,18,人物,1,0,0,1,5528,4,1,"精力充沛的人/乡村一隅/别人家的好房子/安静的地方/想共度时光的人/理想房屋 Describe an energetic person that you know Describe a place in a village that you visited Describe a person's house/apartment that you think is very good Describe a quiet place Describe someone you really like to spend time with Describe an ideal and perfect place where you would like to stay, e.g. a house or an apartment"
64,1709,【疑似淘汰】容易学习的地方\历史建筑,21,地点,0,0,0,1,5405,4,1,Describe a historical building you have been to You should say: Where it is What it looks like What it is used for now what you learned there And how you felt about this historical building； Describe an indoor or outdoor place where it was easy for you to study You should say: Where it is When you go there What you study there Who you go with Why you would study in this place
65,1708,【疑似淘汰】喜欢买便宜货的人\ 音乐爱好者,18,人物,0,0,0,1,5404,4,1,Describe a person who likes to buy goods with low prices You should say: Who this person is What this person likes to buy Where this person likes to buy things And explain why this person likes cheap goods； Describe a person who thinks music is important and enjoys music You should say: Who this person is How you knew him/her What music he/she likes Why he/she thinks music is important And explain how you feel about him/her
66,1707,【疑似淘汰】别人做的好决定\看过并想尝试的运动,20,事件,0,0,0,1,5403,4,1,Describe someone you know who made a good decision recently You should say: Who he/she is When he/she made the decision What decision he/she made Why it was a good decision And explain how you felt about the decision; Describe a sport you watched and would like to try You should say: When and where you watched it Why you watched it Who you watched it with Whether you will do it in the future And explain how you felt about it
67,1706,看到野生动物的地方/公园&花园,21,地点,0,0,0,1,5400,4,1,Describe a place you have been to where you can see wild animals You should say: Where it is When you went there What animals you saw there How you feel about the place； Describe a public park or garden You should say: Where it is What it is like How often you go there What you often do there And explain how you feel about it
68,1691,帮助家人/喜欢做手工的人/向小辈展示新东西,18,人物,0,0,0,1,5309,4,1,"Describe a time when you helped a family member You should say: When it happened Who you helped How you helped And explain how you felt about the experience； Describe a person who likes to make things by hand (e.g. toys, furniture) You should say: Who this person is What he/she makes Why he/she likes to make things by hand And explain how you feel about the person； Describe a time that you showed something which was new to a person who was younger than you You should say: When it was What it was Who you showed it to How you showed it Why you showed it And explain how you felt about it"
69,1688,【疑似淘汰】想换掉的东西/少年的榜样,19,事物,0,0,0,1,5294,4,1,Describe something you own that you want to replace You should say: What it is Where it is How you got it And explain why you want to replace it； Describe someone (a famous person) that is a role model for young people You should say: Who he/she is How you knew him/her What he/she has done And explain why he/she can be a role model for young people
70,1687,【疑似淘汰】聚会\很开心认识的人,20,事件,0,0,0,1,5293,4,1,Describe a party that you enjoyed You should say: When you went to the party Where the party was held What kind of party it was And explain why you enjoyed this party； Describe a person who you are happy to know You should say： Who the person is How you know this person What he or she is like And explain why it is happy to know this person
71,1686,【疑似淘汰】宜居之城\描述一种植物,21,地点,0,0,0,1,5292,4,1,Describe a place (city/town) that is good for people to live in You should say: Where it is How you knew this place What it is like And explain why it is better than other places to live in; Describe an important plant in your country You should say: What it is Where you see it What it looks like Why it is important
72,1685,历史建筑\让你骄傲的事,21,地点,0,0,0,1,5291,4,1,Describe a historical building you have been to You should say: Where it is What it looks like What it is used for now what you learned there And how you felt about this historical building； Describe something you did that made you feel proud You should say: What it was How you did it What difficulty you had How you dealt with the difficulty And explain why you felt proud of it
73,1684,看过但是从未参加过的运动\别人做的好决定\看过并想尝试的运动,20,事件,0,0,0,1,5290,4,1,Describe a sport that you only have watched before but had not played by yourself You should say: What it is When you watched it Where you watched it Who you watched it with And explain how you felt about it; Describe someone you know who made a good decision recently You should say: Who he/she is When he/she made the decision What decision he/she made Why it was a good decision And explain how you felt about the decision; Describe a sport you watched and would like to try You should say: When and where you watched it Why you watched it Who you watched it with Whether you will do it in the future And explain how you felt about it
74,1683,【疑似淘汰】和朋友去的有趣地方\少人去的景点\ 别人做的特殊一餐,21,地点,0,0,0,1,5289,4,1,Describe an interesting place you have been to with a friend You should say: What and where the place is Who you went with When you went there What you did there And explain why you think it is interesting; Describe a tourist attraction that very few people visit but you think is interesting You should say: What the place is What people can see there Why only very few people visit there And explain why you think it is interesting; Describe a special meal that someone made for you You should say: Who did it When and how he/she cooked What and why he/she cooked for you And explain how you felt about the meal
75,1682,教他人做事\教晚辈,20,事件,0,0,0,1,5288,4,1,Describe a time when you taught a friend/relative something You should say: Who you taught What you taught What the result was And explain how you felt about the experience; Describe a time you taught something new to a younger person You should say. When it happened What you taught Who you taught Why you taught this person And how you felt about the teaching
76,1681,【疑似淘汰】嘈杂地\新法律,21,地点,0,0,0,1,5287,4,1,Describe a noisy place you have been to You should say: What it is When you went there What you did there And explain why you feel it's a noisy place； Describe a new law you would like to introduce You should say What law it is What changes this law has Whether this new law will be popular How you came up with the new law And explain how you feel about this new law
77,1680,喜欢买便宜货的人\ 音乐爱好者\居住地发展,18,人物,0,0,0,1,5286,4,1,"Describe a person who likes to buy goods with low prices You should say: Who this person is What this person likes to buy Where this person likes to buy things And explain why this person likes cheap goods； Describe a person who thinks music is important and enjoys music You should say: Who this person is How you knew him/her What music he/she likes Why he/she thinks music is important And explain how you feel about him/her； Describe a new development in the area where you live (e.g.shopping mall, park...) You should say: What the development is When/where you noticed it How long it took to complete it how you feel about it and explain how it has improved the area you live in"
78,1679,【疑似淘汰】自然之地/愉悦的公共交通之旅/ 经常拍照的地方/喜欢的照片&画,21,地点,0,0,0,1,5285,4,1,"Describe a natural place (e.g. parks, mountains) You should say: Where this place is How you knew this place What it is like And explain why you like to visit it； Describe an enjoyable journey by public transport You should say: Where you went Who you were with What you did And how you felt about it； Describe a place where you have taken photos more than once You should say: Where the place is When you took the photos What special features the photos taken there have And explain why you have been there more than once to take photos； Describe a picture/photograph of you that you like You should say: Where it was taken/drawn When it was taken/drawn Who took/drew it And explain how you felt about it"
79,1678,【疑似淘汰】助你实现目标的人\有趣的老人,18,人物,0,0,0,1,5284,4,1,Describe a person who encouraged and helped you to achieve a goal You should say: who this person is what this person encouraged you to do how this person helped you And explain why this encouragement helped you to achieve your goal; Describe an interesting old person you met You should say: Who this person is When/where you met this person What you did with this person And explain why you think this person is interesting
80,1677,家里让你放松的地方\ 容易学习的地方,21,地点,0,0,0,1,5283,4,1,Describe your favorite place in your house where you can relax You should say: Where it is What it is like What you enjoy doing there And explain why you feel relaxed at this place； Describe an indoor or outdoor place where it is easy for you to study You should say: Where it is What it is like When you go there What you study there And explain why you would like to study in this Place
81,1676,【疑似淘汰】迟到\冒风险,20,事件,0,0,0,1,5282,4,1,Describe a time when you missed or were late for a meeting/event You should say: When it happened What happened Why you missed/were late for it And explain how you felt about this experience； Describe a risk you took that you thought would lead to a terrible result but ended up with a positive result You should say: When you took the risk Why you took the risk How it went And explain how you felt about it
82,1674,优质服务/和亲友去的地方,20,事件,0,0,0,1,5279,4,1,Describe a shop where you received a good service from one of the staff You should say: Where the shop is When you received the good service What service you received And explain how you felt about the service； Describe a place in your hometown/city that is different from other places and that you enjoy visiting with your parents/friends You should say: Where it is What it is like What you often do there Who you often go there with And explain why you think it is different
83,1673,别人家的房间/近期观影,21,地点,0,0,0,1,5278,4,1,Describe a room you really like in another person's home You should say: Where it is What it is like What you can do in it And explain why you really like it； Describe a movie you watched recently You should say: When and where you watched it Who you watched it with What it was about And explain why you chose to watch this movie
84,1672,公共场所接陌生人电话/困难挑战,20,事件,0,0,0,1,5277,4,1,Describe a time when you answered a phone call from someone you didn't know in a public place You should say: Where it happened What he/she said How you corresponded And explain how you felt about the experience； Describe a challenge you faced that you thought was rather difficult You should say: What it was When and where you faced it Why you thought it was a difficult challenge And explain how you felt at the time
85,1671,帮助家人/喜欢做手工的人,18,人物,0,0,0,1,5276,4,1,"Describe a time when you helped a family member You should say: When it happened Who you helped How you helped And explain how you felt about the experience； Describe a person who likes to make things by hand (e.g. toys, furniture) You should say: Who this person is What he/she makes Why he/she likes to make things by hand And explain how you feel about the person"
86,1670,医疗人士/认识的老人/给建议的人/生活有趣的老人,18,人物,0,0,0,1,5275,4,1,"Describe a person who has chosen a career in the medical field (e.g. a doctor, a nurse） You should say: Who he/she is What he/she does Why he/she chose this career And explain how you feel about him/her； Describe an old person you know You should say: Who this person is Where he/she lives in What he/she has done in his/her life And explain how you feel about this person； Describe a person from whom others like to ask for advice You should say: Who this person is Why people like to ask for his/her advice What kind of advice he/she often gives And explain how you felt about the person； Describe an old person you know who has had an interesting life You should say: Who this person is Where he/she lives What he/she has done in his/her life And explain how you feel about him/her"
87,1668,昂贵物品/弄丢贵重物品,19,事物,0,0,0,1,5273,4,1,Describe the most expensive item you have ever bought You should say: When and where you bought it What it was What you used it for And explain how you liked it； Describe a time when you lost a valuable item You should say: When and where it happened What it was How valuable it was How you lost it And explain how you felt about the experience
88,1667,重遇旧友/阅读爱好者,18,人物,0,0,0,1,5272,4,1,Describe an old friend you had lost touch with and got in contact with again You should say : Who he/she is How you knew each other Why you lost contact How you got in contact again And explain how you felt after getting in contact again； Describe a person who likes to read a lot You should say: Who this person is How you knew him/her What he/she likes to read And explain why you think he/she likes to read a lot
89,1666,文化之地/拥挤地方,21,地点,0,0,0,1,5271,4,1,"Describe a cultural place (e.g. library, museum,theatre) You should say: Where it is How you knew this place What it is like And explain how the place is related to culture； Describe a crowded place you went to You should say: When you went there Who you went there with Why you went there And how you felt about it"
90,1665,理想房屋/学到新东西的网络视频,19,事物,0,0,0,1,5270,4,1,"Describe an ideal and perfect place where you would like to stay, e.g. a house or an apartment You should say: Where it would be What it would look like What special features it would have And explain why it would be an ideal place for you； Describe an online video where you learned something new You should say: When and where you watched it What it was Why you watched it And explain what you have learned from it"
91,1664,固执己见的人/节日食物,18,人物,0,0,0,1,5269,4,1,Describe a person who always has strong opinions You should say: Who this person is How you knew him/her Why you think he/she is an opinionated person And explain how you feel about him/her； Describe your favourite food at a traditional festival or a special event in your country You should say: What it is At which festival/event you eat it How it is made And explain why you like it
92,1663,令你自信的事/获奖,20,事件,0,0,0,1,5268,4,1,Describe something that made you feel confident You should say: What it was Why it made you feel confident； Describe a prize you have received (e.g. a medal) You should say: What it was When you received it What you did to receive it And explain how you felt about it
93,1661,聚会\感兴趣的历史时期,19,事物,0,0,0,1,5228,4,1,Describe a party that you enjoyed You should say: When you went to the party Where the party was held What kind of party it was And explain why you enjoyed this party； Describe a historical period you would like to know more You should say: When it happened What you are interested in What you have known And explain why you would like to know more
94,1622,学会的新技能/比赛赢家/居住地体育运动,19,事物,0,0,0,1,4989,4,1,Describe a new skill that you learned You should say: What it was How long you learned it Why you learned it And explain how long you will use the skill； Describe a person who won a competition You should say: Who this person was What the competition was about What he/she did to win the competition And explain how you felt about this； Describe a popular physical exercise where you live You should say: What it is When and where people do it Why it is popular And explain how you feel about it
95,1617,宜居之城\他城的短暂停留\喜欢的气候\描述一种植物,21,地点,0,0,0,1,4971,4,1,Describe a place (city/town) that is good for people to live in You should say: Where it is How you knew this place What it is like And explain why it is better than other places to live in; Describe another city you would like to stay for a short time You should say: Where the city is Why you want to go there Whom you will go there with What you will do there And explain why you will stay there just for a short time; Describe your favourite climate You should say: What kind of climate it is Where the climate occur How hot or cold the climate is And explain why you like this type of climate; Describe an important plant in your country You should say: What it is Where you see it What it looks like Why it is important
96,1616,历史建筑/想要一起学习\工作的人/ 和别人一起做的事/ 让你骄傲的事,19,事物,0,0,0,1,4970,4,1,Describe a historical building you have been to You should say: Where it is What it looks like What it is used for now what you learned there And how you felt about this historical building； Describe a person you have met who you want to work/study with You should say: Who this person is How you met this person How long you have known him/her And explain why you want to work/study with him/her； Describe something that you did with someone/a group of people You should say: What it was Who you did it with How long it took you to do this And explain why you did it together； Describe something you did that made you feel proud You should say: What it was How you did it What difficulty you had How you dealt with the difficulty And explain why you felt proud of it
97,1615,看过但是从未参加过的运动\别人做的好决定\常用网站 \参加过的公众活动看过并想尝试的运动,19,事物,0,0,0,1,4969,4,1,Describe a sport that you only have watched before but had not played by yourself You should say: What it is When you watched it Where you watched it Who you watched it with And explain how you felt about it; Describe someone you know who made a good decision recently You should say: Who he/she is When he/she made the decision What decision he/she made Why it was a good decision And explain how you felt about the decision; Describe a website you often visit You should say: How you found it What it is about How often you visit it And explain why you often visit it; Describe a public event you have attended You should say: What the event was When you went there Whom you went there with And explain why you enjoyed this event； Describe a sport you watched and would like to try You should say: When and where you watched it Why you watched it Who you watched it with Whether you will do it in the future And explain how you felt about it
98,1614,和朋友去的有趣地方\少人去的景点\外国食物\不寻常的一餐\ 别人做的特殊一餐,21,地点,0,0,0,1,4968,4,1,Describe an interesting place you have been to with a friend You should say: What and where the place is Who you went with When you went there What you did there And explain why you think it is interesting; Describe a tourist attraction that very few people visit but you think is interesting You should say: What the place is What people can see there Why only very few people visit there And explain why you think it is interesting; Describe a kind of foreign food you have had You should say: When you had it Where you ate it What it was And explain how you felt about it; Describe an unusual meal you had You should say： When you had it Where you had it Whom you had it with And explain why it was unusual; Describe a special meal that someone made for you You should say: Who did it When and how he/she cooked What and why he/she cooked for you And explain how you felt about the meal
99,1613,【疑似淘汰】最好的衫\昂贵地方\收到想要物品,19,事物,0,0,0,1,4967,4,1,Describe an occasion you wore the best clothes You should say： When it was Where it was What you wore What it looked like And explain why you wore it; Describe a place you have been to where things are expensive You should say: Where the place is What the place is like Why you went there What you bought there And explain why you think things are expensive there; Describe a time when someone gave you something that you really wanted You should say: What it was When you received it Who gave it to you And explain why you wanted it so much
100,1612,认识的小孩\教他人做事\教晚辈\收钱,18,人物,3,0,0,1,4966,4,1,Describe a child that you know You should say: Who this child is How often you see this child What this child is like And explain how you feel about this child; Describe a time when you taught a friend/relative something You should say: Who you taught What you taught What the result was And explain how you felt about the experience; Describe a time you taught something new to a younger person You should say. When it happened What you taught Who you taught Why you taught this person And how you felt about the teaching; Describe a time when you received money as a gift You should say: When it happened Who gave you money Why he/she gave you money And explain how you used the money
